### ISSUE TITLE
[cinder-csi-plugin] cant connect to openstack (no route to host)

### ISSUE THREAD

**Issue by elgamal2020** [kubernetes/cloud-provider-openstack#1282]
**Is this a BUG REPORT or FEATURE REQUEST?**:

> Uncomment only one, leave it on its own line: 
 /kind bug
> /kind feature

**What happened**:

I have two system installed via Kubespray , once can connect and have cinder volumes correctly fucntioning and the other cant connect to openstack 

I increased the log to 5 and no much data was seen 

I tried both deployment and stateful set 
```

 kubectl logs pod/csi-cinder-controllerplugin-7557c44bd8-nfww4 -n kube-system -c cinder-csi-plugin
I1020 02:55:16.977653       1 driver.go:69] Driver: cinder.csi.openstack.org
I1020 02:55:16.977879       1 driver.go:70] Driver version: 1.2.1@latest
I1020 02:55:16.977924       1 driver.go:71] CSI Spec version: 1.2.0
I1020 02:55:16.978038       1 driver.go:100] Enabling controller service capability: LIST_VOLUMES
I1020 02:55:16.978081       1 driver.go:100] Enabling controller service capability: CREATE_DELETE_VOLUME
I1020 02:55:16.978109       1 driver.go:100] Enabling controller service capability: PUBLISH_UNPUBLISH_VOLUME
I1020 02:55:16.978138       1 driver.go:100] Enabling controller service capability: CREATE_DELETE_SNAPSHOT
I1020 02:55:16.978186       1 driver.go:100] Enabling controller service capability: LIST_SNAPSHOTS
I1020 02:55:16.978830       1 driver.go:100] Enabling controller service capability: EXPAND_VOLUME
I1020 02:55:16.978900       1 driver.go:100] Enabling controller service capability: CLONE_VOLUME
I1020 02:55:16.978936       1 driver.go:100] Enabling controller service capability: LIST_VOLUMES_PUBLISHED_NODES
I1020 02:55:16.978978       1 driver.go:112] Enabling volume access mode: SINGLE_NODE_WRITER
I1020 02:55:16.979004       1 driver.go:122] Enabling node service capability: STAGE_UNSTAGE_VOLUME
I1020 02:55:16.979030       1 driver.go:122] Enabling node service capability: EXPAND_VOLUME
I1020 02:55:16.979055       1 driver.go:122] Enabling node service capability: GET_VOLUME_STATS
I1020 02:55:16.979103       1 openstack.go:129] InitOpenStackProvider configFile: /etc/config/cloud.conf
I1020 02:55:16.980355       1 openstack.go:240] AuthURL: http://172.18.234.183:5000/v3/
I1020 02:55:16.980753       1 openstack.go:241] UserID:
I1020 02:55:16.980801       1 openstack.go:242] Username: user22
I1020 02:55:16.980835       1 openstack.go:243] TenantID: 5f134e0cc666498b89eb3ddb0204bc3f
I1020 02:55:16.980862       1 openstack.go:244] TenantName: public
I1020 02:55:16.980953       1 openstack.go:245] TrustID:
I1020 02:55:16.982250       1 openstack.go:246] DomainID:
I1020 02:55:16.982319       1 openstack.go:247] DomainName: Default
I1020 02:55:16.982348       1 openstack.go:248] TenantDomainID:
I1020 02:55:16.982442       1 openstack.go:249] TenantDomainName:
I1020 02:55:16.982513       1 openstack.go:250] UserDomainID:
I1020 02:55:16.982544       1 openstack.go:251] UserDomainName:
I1020 02:55:16.982584       1 openstack.go:252] Region: RegionOne
I1020 02:55:16.982622       1 openstack.go:253] CAFile:
I1020 02:55:16.982659       1 openstack.go:254] CertFile:
I1020 02:55:16.982692       1 openstack.go:255] KeyFile:
I1020 02:55:16.982746       1 openstack.go:256] UseClouds: false
I1020 02:55:16.982806       1 openstack.go:257] CloudsFile:
I1020 02:55:16.982845       1 openstack.go:258] Cloud:
I1020 02:55:16.982912       1 openstack.go:259] ApplicationCredentialID:
I1020 02:55:16.982965       1 openstack.go:260] ApplicationCredentialName:
I1020 02:55:16.982996       1 openstack.go:87] Block storage opts: {0 false}
I1020 02:55:16.983245       1 openstack.go:515] Using user-agent cinder-csi-plugin/latest gophercloud/2.0.0
W1020 02:55:20.061158       1 main.go:108] Failed to GetOpenStackProvider: Post "http://172.18.234.183:5000/v3/auth/tokens": dial tcp 172.18.234.183:5000: connect: no route to host
nnadmin@test-mgmt-tdb-1:~$
nnadmin@test-mgmt-tdb-1:~$ kubectl get all -o wide -n kube-system | grep cinder
pod/csi-cinder-controllerplugin-7557c44bd8-nfww4   4/5     CrashLoopBackOff   5          4m40s   10.233.102.14   test-master-2   <none>           <none>
pod/csi-cinder-nodeplugin-2wwjw                    2/2     Running            0          11d     10.100.15.31    test-bsf-2     <none>           <none>
pod/csi-cinder-nodeplugin-2zs95                    2/2     Running            0          11d     10.100.15.20    test-master-1   <none>           <none>
pod/csi-cinder-nodeplugin-6l9rc                    2/2     Running            0          11d     10.100.15.41    test-nrf-2     <none>           <none>
pod/csi-cinder-nodeplugin-6tw8k                    2/2     Running            0          11d     10.100.15.60    test-sepp-1    <none>           <none>
pod/csi-cinder-nodeplugin-f5b97                    2/2     Running            0          11d     10.100.15.61    test-sepp-2    <none>           <none>
pod/csi-cinder-nodeplugin-fhhhg                    2/2     Running            0          11d     10.100.15.22    test-master-3   <none>           <none>
pod/csi-cinder-nodeplugin-ghngx                    2/2     Running            0          11d     10.100.15.30    test-worker1-1     <none>           <none>
pod/csi-cinder-nodeplugin-jtss4                    2/2     Running            0          11d     10.100.15.40    test-worker2-1     <none>           <none>
pod/csi-cinder-nodeplugin-rbkmn                    2/2     Running            0          11d     10.100.15.21    test-master-2   <none>           <none>
pod/csi-cinder-nodeplugin-t7g5h                    2/2     Running            0          11d     10.100.15.51    test-worker3-2     <none>           <none>
pod/csi-cinder-nodeplugin-z9qdk                    2/2     Running            0          11d     10.100.15.50    test-worker3-1     <none>           <none>
service/csi-cinder-controller-service        ClusterIP   10.233.17.83    <none>        12345/TCP                11d   app=csi-cinder-controllerplugin
daemonset.apps/csi-cinder-nodeplugin                11        11        11      11           11          <none>                            11d   node-driver-registrar,cinder-csi-plugin   quay.io/k8scsi/csi-node-driver-registrar:v1.2.0,docker.io/k8scloudprovider/cinder-csi-plugin:latest   app=csi-cinder-nodeplugin
deployment.apps/csi-cinder-controllerplugin   0/1     1            0           4m40s   csi-attacher,csi-provisioner,csi-snapshotter,csi-resizer,cinder-csi-plugin   quay.io/k8scsi/csi-attacher:v2.2.0,quay.io/k8scsi/csi-provisioner:v1.6.0,quay.io/k8scsi/csi-snapshotter:v2.1.1,quay.io/k8scsi/csi-resizer:v0.5.0,docker.io/k8scloudprovider/cinder-csi-plugin:latest   app=csi-cinder-controllerplugin
replicaset.apps/csi-cinder-controllerplugin-7557c44bd8   1         1         0       4m40s   csi-attacher,csi-provisioner,csi-snapshotter,csi-resizer,cinder-csi-plugin   quay.io/k8scsi/csi-attacher:v2.2.0,quay.io/k8scsi/csi-provisioner:v1.6.0,quay.io/k8scsi/csi-snapshotter:v2.1.1,quay.io/k8scsi/csi-resizer:v0.5.0,docker.io/k8scloudprovider/cinder-csi-plugin:latest   app=csi-cinder-controllerplugin,pod-template-hash=7557c44bd8


kubectl -n kube-system get pod csi-cinder-controllerplugin-7557c44bd8-nfww4 -o yaml
apiVersion: v1
kind: Pod
metadata:
  annotations:
    k8s.v1.cni.cncf.io/network-status: |-
      [{
          "name": "",
          "ips": [
              "10.233.102.14"
          ],
          "default": true,
          "dns": {}
      }]
    k8s.v1.cni.cncf.io/networks-status: |-
      [{
          "name": "",
          "ips": [
              "10.233.102.14"
          ],
          "default": true,
          "dns": {}
      }]
  creationTimestamp: "2020-10-20T02:54:51Z"
  generateName: csi-cinder-controllerplugin-7557c44bd8-
  labels:
    app: csi-cinder-controllerplugin
    pod-template-hash: 7557c44bd8
  managedFields:
  - apiVersion: v1
    fieldsType: FieldsV1
    fieldsV1:
      f:metadata:
        f:generateName: {}
        f:labels:
          .: {}
          f:app: {}
          f:pod-template-hash: {}
        f:ownerReferences:
          .: {}
          k:{"uid":"a2beee6e-364c-459a-9621-b8c5d1c9c13a"}:
            .: {}
            f:apiVersion: {}
            f:blockOwnerDeletion: {}
            f:controller: {}
            f:kind: {}
            f:name: {}
            f:uid: {}
      f:spec:
        f:containers:
          k:{"name":"cinder-csi-plugin"}:
            .: {}
            f:args: {}
            f:env:
              .: {}
              k:{"name":"CLOUD_CONFIG"}:
                .: {}
                f:name: {}
                f:value: {}
              k:{"name":"CLUSTER_NAME"}:
                .: {}
                f:name: {}
                f:value: {}
              k:{"name":"CSI_ENDPOINT"}:
                .: {}
                f:name: {}
                f:value: {}
              k:{"name":"NODE_ID"}:
                .: {}
                f:name: {}
                f:valueFrom:
                  .: {}
                  f:fieldRef:
                    .: {}
                    f:apiVersion: {}
                    f:fieldPath: {}
            f:image: {}
            f:imagePullPolicy: {}
            f:name: {}
            f:resources: {}
            f:terminationMessagePath: {}
            f:terminationMessagePolicy: {}
            f:volumeMounts:
              .: {}
              k:{"mountPath":"/csi"}:
                .: {}
                f:mountPath: {}
                f:name: {}
              k:{"mountPath":"/etc/config"}:
                .: {}
                f:mountPath: {}
                f:name: {}
                f:readOnly: {}
          k:{"name":"csi-attacher"}:
            .: {}
            f:args: {}
            f:env:
              .: {}
              k:{"name":"ADDRESS"}:
                .: {}
                f:name: {}
                f:value: {}
            f:image: {}
            f:imagePullPolicy: {}
            f:name: {}
            f:resources: {}
            f:terminationMessagePath: {}
            f:terminationMessagePolicy: {}
            f:volumeMounts:
              .: {}
              k:{"mountPath":"/var/lib/csi/sockets/pluginproxy/"}:
                .: {}
                f:mountPath: {}
                f:name: {}
          k:{"name":"csi-provisioner"}:
            .: {}
            f:args: {}
            f:env:
              .: {}
              k:{"name":"ADDRESS"}:
                .: {}
                f:name: {}
                f:value: {}
            f:image: {}
            f:imagePullPolicy: {}
            f:name: {}
            f:resources: {}
            f:terminationMessagePath: {}
            f:terminationMessagePolicy: {}
            f:volumeMounts:
              .: {}
              k:{"mountPath":"/var/lib/csi/sockets/pluginproxy/"}:
                .: {}
                f:mountPath: {}
                f:name: {}
          k:{"name":"csi-resizer"}:
            .: {}
            f:args: {}
            f:env:
              .: {}
              k:{"name":"ADDRESS"}:
                .: {}
                f:name: {}
                f:value: {}
            f:image: {}
            f:imagePullPolicy: {}
            f:name: {}
            f:resources: {}
            f:terminationMessagePath: {}
            f:terminationMessagePolicy: {}
            f:volumeMounts:
              .: {}
              k:{"mountPath":"/var/lib/csi/sockets/pluginproxy/"}:
                .: {}
                f:mountPath: {}
                f:name: {}
          k:{"name":"csi-snapshotter"}:
            .: {}
            f:args: {}
            f:env:
              .: {}
              k:{"name":"ADDRESS"}:
                .: {}
                f:name: {}
                f:value: {}
            f:image: {}
            f:imagePullPolicy: {}
            f:name: {}
            f:resources: {}
            f:terminationMessagePath: {}
            f:terminationMessagePolicy: {}
            f:volumeMounts:
              .: {}
              k:{"mountPath":"/var/lib/csi/sockets/pluginproxy/"}:
                .: {}
                f:mountPath: {}
                f:name: {}
        f:dnsPolicy: {}
        f:enableServiceLinks: {}
        f:nodeSelector:
          .: {}
          f:nni-node-type: {}
        f:restartPolicy: {}
        f:schedulerName: {}
        f:securityContext: {}
        f:serviceAccount: {}
        f:serviceAccountName: {}
        f:terminationGracePeriodSeconds: {}
        f:volumes:
          .: {}
          k:{"name":"secret-cinderplugin"}:
            .: {}
            f:name: {}
            f:secret:
              .: {}
              f:defaultMode: {}
              f:secretName: {}
          k:{"name":"socket-dir"}:
            .: {}
            f:emptyDir: {}
            f:name: {}
    manager: kube-controller-manager
    operation: Update
    time: "2020-10-20T02:54:51Z"
  - apiVersion: v1
    fieldsType: FieldsV1
    fieldsV1:
      f:metadata:
        f:annotations:
          .: {}
          f:k8s.v1.cni.cncf.io/network-status: {}
          f:k8s.v1.cni.cncf.io/networks-status: {}
    manager: multus
    operation: Update
    time: "2020-10-20T02:54:52Z"
  - apiVersion: v1
    fieldsType: FieldsV1
    fieldsV1:
      f:status:
        f:conditions:
          k:{"type":"ContainersReady"}:
            .: {}
            f:lastProbeTime: {}
            f:lastTransitionTime: {}
            f:message: {}
            f:reason: {}
            f:status: {}
            f:type: {}
          k:{"type":"Initialized"}:
            .: {}
            f:lastProbeTime: {}
            f:lastTransitionTime: {}
            f:status: {}
            f:type: {}
          k:{"type":"Ready"}:
            .: {}
            f:lastProbeTime: {}
            f:lastTransitionTime: {}
            f:message: {}
            f:reason: {}
            f:status: {}
            f:type: {}
        f:containerStatuses: {}
        f:hostIP: {}
        f:phase: {}
        f:podIP: {}
        f:podIPs:
          .: {}
          k:{"ip":"10.233.102.14"}:
            .: {}
            f:ip: {}
        f:startTime: {}
    manager: kubelet
    operation: Update
    time: "2020-10-20T03:06:12Z"
  name: csi-cinder-controllerplugin-7557c44bd8-nfww4
  namespace: kube-system
  ownerReferences:
  - apiVersion: apps/v1
    blockOwnerDeletion: true
    controller: true
    kind: ReplicaSet
    name: csi-cinder-controllerplugin-7557c44bd8
    uid: a2beee6e-364c-459a-9621-b8c5d1c9c13a
  resourceVersion: "6316974"
  selfLink: /api/v1/namespaces/kube-system/pods/csi-cinder-controllerplugin-7557c44bd8-nfww4
  uid: 0fe2f341-e516-470e-b979-7b97135650be
spec:
  containers:
  - args:
    - --csi-address=$(ADDRESS)
    - --timeout=3m
    env:
    - name: ADDRESS
      value: /var/lib/csi/sockets/pluginproxy/csi.sock
    image: quay.io/k8scsi/csi-attacher:v2.2.0
    imagePullPolicy: IfNotPresent
    name: csi-attacher
    resources: {}
    terminationMessagePath: /dev/termination-log
    terminationMessagePolicy: File
    volumeMounts:
    - mountPath: /var/lib/csi/sockets/pluginproxy/
      name: socket-dir
    - mountPath: /var/run/secrets/kubernetes.io/serviceaccount
      name: csi-cinder-controller-sa-token-zhlsn
      readOnly: true
  - args:
    - --csi-address=$(ADDRESS)
    - --timeout=3m
    env:
    - name: ADDRESS
      value: /var/lib/csi/sockets/pluginproxy/csi.sock
    image: quay.io/k8scsi/csi-provisioner:v1.6.0
    imagePullPolicy: IfNotPresent
    name: csi-provisioner
    resources: {}
    terminationMessagePath: /dev/termination-log
    terminationMessagePolicy: File
    volumeMounts:
    - mountPath: /var/lib/csi/sockets/pluginproxy/
      name: socket-dir
    - mountPath: /var/run/secrets/kubernetes.io/serviceaccount
      name: csi-cinder-controller-sa-token-zhlsn
      readOnly: true
  - args:
    - --csi-address=$(ADDRESS)
    env:
    - name: ADDRESS
      value: /var/lib/csi/sockets/pluginproxy/csi.sock
    image: quay.io/k8scsi/csi-snapshotter:v2.1.1
    imagePullPolicy: IfNotPresent
    name: csi-snapshotter
    resources: {}
    terminationMessagePath: /dev/termination-log
    terminationMessagePolicy: File
    volumeMounts:
    - mountPath: /var/lib/csi/sockets/pluginproxy/
      name: socket-dir
    - mountPath: /var/run/secrets/kubernetes.io/serviceaccount
      name: csi-cinder-controller-sa-token-zhlsn
      readOnly: true
  - args:
    - --csi-address=$(ADDRESS)
    env:
    - name: ADDRESS
      value: /var/lib/csi/sockets/pluginproxy/csi.sock
    image: quay.io/k8scsi/csi-resizer:v0.5.0
    imagePullPolicy: IfNotPresent
    name: csi-resizer
    resources: {}
    terminationMessagePath: /dev/termination-log
    terminationMessagePolicy: File
    volumeMounts:
    - mountPath: /var/lib/csi/sockets/pluginproxy/
      name: socket-dir
    - mountPath: /var/run/secrets/kubernetes.io/serviceaccount
      name: csi-cinder-controller-sa-token-zhlsn
      readOnly: true
  - args:
    - /bin/cinder-csi-plugin
    - --nodeid=$(NODE_ID)
    - --endpoint=$(CSI_ENDPOINT)
    - --cloud-config=$(CLOUD_CONFIG)
    - --cluster=$(CLUSTER_NAME)
    - --v=5
    env:
    - name: NODE_ID
      valueFrom:
        fieldRef:
          apiVersion: v1
          fieldPath: spec.nodeName
    - name: CSI_ENDPOINT
      value: unix://csi/csi.sock
    - name: CLOUD_CONFIG
      value: /etc/config/cloud.conf
    - name: CLUSTER_NAME
      value: kubernetes
    image: docker.io/k8scloudprovider/cinder-csi-plugin:latest
    imagePullPolicy: IfNotPresent
    name: cinder-csi-plugin
    resources: {}
    terminationMessagePath: /dev/termination-log
    terminationMessagePolicy: File
    volumeMounts:
    - mountPath: /csi
      name: socket-dir
    - mountPath: /etc/config
      name: secret-cinderplugin
      readOnly: true
    - mountPath: /var/run/secrets/kubernetes.io/serviceaccount
      name: csi-cinder-controller-sa-token-zhlsn
      readOnly: true
  dnsPolicy: ClusterFirst
  enableServiceLinks: true
  nodeName: nn-mgmt-tdb-2
  nodeSelector:
    nni-node-type: mgmt
  preemptionPolicy: PreemptLowerPriority
  priority: 0
  restartPolicy: Always
  schedulerName: default-scheduler
  securityContext: {}
  serviceAccount: csi-cinder-controller-sa
  serviceAccountName: csi-cinder-controller-sa
  terminationGracePeriodSeconds: 30
  tolerations:
  - effect: NoExecute
    key: node.kubernetes.io/not-ready
    operator: Exists
    tolerationSeconds: 300
  - effect: NoExecute
    key: node.kubernetes.io/unreachable
    operator: Exists
    tolerationSeconds: 300
  volumes:
  - emptyDir: {}
    name: socket-dir
  - name: secret-cinderplugin
    secret:
      defaultMode: 420
      secretName: cloud-config
  - name: csi-cinder-controller-sa-token-zhlsn
    secret:
      defaultMode: 420
      secretName: csi-cinder-controller-sa-token-zhlsn
status:
  conditions:
  - lastProbeTime: null
    lastTransitionTime: "2020-10-20T02:54:51Z"
    status: "True"
    type: Initialized
  - lastProbeTime: null
    lastTransitionTime: "2020-10-20T03:06:01Z"
    message: 'containers with unready status: [cinder-csi-plugin]'
    reason: ContainersNotReady
    status: "False"
    type: Ready
  - lastProbeTime: null
    lastTransitionTime: "2020-10-20T03:06:01Z"
    message: 'containers with unready status: [cinder-csi-plugin]'
    reason: ContainersNotReady
    status: "False"
    type: ContainersReady
  - lastProbeTime: null
    lastTransitionTime: "2020-10-20T02:54:51Z"
    status: "True"
    type: PodScheduled
  containerStatuses:
  - containerID: docker://60ba26f6b71fd860f823357c774e9f1dee4c4a8e9ba399a6a930b8999b3e72f3
    image: k8scloudprovider/cinder-csi-plugin:latest
    imageID: docker-pullable://k8scloudprovider/cinder-csi-plugin@sha256:afe3f0c5263e3a67b6b4386138fc61c289df3fc9fad8d35bfb16d1ab45a938e0
    lastState:
      terminated:
        containerID: docker://60ba26f6b71fd860f823357c774e9f1dee4c4a8e9ba399a6a930b8999b3e72f3
        exitCode: 0
        finishedAt: "2020-10-20T03:06:01Z"
        reason: Completed
        startedAt: "2020-10-20T03:05:58Z"
    name: cinder-csi-plugin
    ready: false
    restartCount: 7
    started: false
    state:
      waiting:
        message: back-off 5m0s restarting failed container=cinder-csi-plugin pod=csi-cinder-controllerplugin-7557c44bd8-nfww4_kube-system(0fe2f341-e516-470e-b979-7b97135650be)
        reason: CrashLoopBackOff
  - containerID: docker://97fb4181c77b5bcb0c4957e0b46145ca5257eb1ba07990e7c44d0b1f49f3f4be
    image: quay.io/k8scsi/csi-attacher:v2.2.0
    imageID: docker-pullable://quay.io/k8scsi/csi-attacher@sha256:2ffa647e8107cfd39e5f464e738dce014c9f5e51b108da36c3ab621048d0bbab
    lastState: {}
    name: csi-attacher
    ready: true
    restartCount: 0
    started: true
    state:
      running:
        startedAt: "2020-10-20T02:54:53Z"
  - containerID: docker://a49f74654f91ada3b885f470ca1369733d552dd606fe3dbaccb2a3c7b00b3b7e
    image: quay.io/k8scsi/csi-provisioner:v1.6.0
    imageID: docker-pullable://quay.io/k8scsi/csi-provisioner@sha256:78e3393f5fd5ff6c1e5dada2478cfa456fb7164929e573cf9a87bf6532730679
    lastState: {}
    name: csi-provisioner
    ready: true
    restartCount: 0
    started: true
    state:
      running:
        startedAt: "2020-10-20T02:54:53Z"
  - containerID: docker://0934ea1c1a984ea9cd6d78522e5a8a39ab2bb3b76188970a7586a5e60cc1c8f8
    image: quay.io/k8scsi/csi-resizer:v0.5.0
    imageID: docker-pullable://quay.io/k8scsi/csi-resizer@sha256:6c6a0332693a7c456378f6abd2bb40611826c1e1a733cadbdae2daab3125b71c
    lastState: {}
    name: csi-resizer
    ready: true
    restartCount: 0
    started: true
    state:
      running:
        startedAt: "2020-10-20T02:54:53Z"
  - containerID: docker://129cd3d221724f2e1f48bea79c71ff7b8fc57f35a60498a72ddb6f8348ca98ca
    image: quay.io/k8scsi/csi-snapshotter:v2.1.1
    imageID: docker-pullable://quay.io/k8scsi/csi-snapshotter@sha256:de94e695fc27ee421da8b9932c3d42699fe7b848bc34717f67f4350946bc46c9
    lastState: {}
    name: csi-snapshotter
    ready: true
    restartCount: 0
    started: true
    state:
      running:
        startedAt: "2020-10-20T02:54:53Z"
  hostIP: 10.100.15.21
  phase: Running
  podIP: 10.233.102.14
  podIPs:
  - ip: 10.233.102.14
  qosClass: BestEffort
  startTime: "2020-10-20T02:54:51Z"


```

**What you expected to happen**:

**How to reproduce it**:

**Anything else we need to know?**:

**Environment**:
- openstack-cloud-controller-manager(or other related binary) version:
- OpenStack version:
- Others:

**Comment by elgamal2020** [comment]
Also , in TCPdump via the pod calico interface , I can see it tries to reach multiple times towards the openstack 






```





 sudo tcpdump -i cali4e1dcfd8987 -vv
tcpdump: listening on cali4e1dcfd8987, link-type EN10MB (Ethernet), capture size 262144 bytes

04:53:23.993197 IP (tos 0x0, ttl 64, id 863, offset 0, flags [DF], proto TCP (6), length 60)












    10.233.102.22.41006 > 172.18.234.183.5000: Flags [S], cksum 0x07f8 (incorrect -> 0x35a5), seq 3393546824, win 64240, options [mss 1460,sackOK,TS val 2519109941 ecr 0,nop,wscale 7], length 0
04:53:25.020106 IP (tos 0x0, ttl 64, id 864, offset 0, flags [DF], proto TCP (6), length 60)
    10.233.102.22.41006 > 172.18.234.183.5000: Flags [S], cksum 0x07f8 (incorrect -> 0x31a2), seq 3393546824, win 64240, options [mss 1460,sackOK,TS val 2519110968 ecr 0,nop,wscale 7], length 0
04:53:27.036160 IP (tos 0x0, ttl 64, id 865, offset 0, flags [DF], proto TCP (6), length 60)
    10.233.102.22.41006 > 172.18.234.183.5000: Flags [S], cksum 0x07f8 (incorrect -> 0x29c2), seq 3393546824, win 64240, options [mss 1460,sackOK,TS val 2519112984 ecr 0,nop,wscale 7], length 0
04:53:27.068141 IP (tos 0xc0, ttl 64, id 15303, offset 0, flags [none], proto ICMP (1), length 88)
    host-10-100-16-21.openstacklocal > 10.233.102.22: ICMP host 172.18.234.183 unreachable, length 68
        IP (tos 0x0, ttl 63, id 863, offset 0, flags [DF], proto TCP (6), length 60)
    10.233.102.22.41006 > 172.18.234.183.5000: Flags [S], cksum 0x3b4e (incorrect -> 0x35a5), seq 3393546824, win 64240, options [mss 1460,sackOK,TS val 2519109941 ecr 0,nop,wscale 7], length 0
04:53:27.068165 IP (tos 0xc0, ttl 64, id 15304, offset 0, flags [none], proto ICMP (1), length 88)
    host-10-100-16-21.openstacklocal > 10.233.102.22: ICMP host 172.18.234.183 unreachable, length 68
        IP (tos 0x0, ttl 63, id 864, offset 0, flags [DF], proto TCP (6), length 60)
    10.233.102.22.41006 > 172.18.234.183.5000: Flags [S], cksum 0x3b4e (incorrect -> 0x31a2), seq 3393546824, win 64240, options [mss 1460,sackOK,TS val 2519110968 ecr 0,nop,wscale 7], length 0
04:53:27.068176 IP (tos 0xc0, ttl 64, id 15305, offset 0, flags [none], proto ICMP (1), length 88)
    host-10-100-16-21.openstacklocal > 10.233.102.22: ICMP host 172.18.234.183 unreachable, length 68
        IP (tos 0x0, ttl 63, id 865, offset 0, flags [DF], proto TCP (6), length 60)
    10.233.102.22.41006 > 172.18.234.183.5000: Flags [S], cksum 0x3b4e (incorrect -> 0x29c2), seq 3393546824, win 64240, options [mss 1460,sackOK,TS val 2519112984 ecr 0,nop,wscale 7], length 0
04:53:29.180179 ARP, Ethernet (len 6), IPv4 (len 4), Request who-has 169.254.1.1 tell 10.233.102.22, length 28
04:53:29.180310 ARP, Ethernet (len 6), IPv4 (len 4), Reply 169.254.1.1 is-at ee:ee:ee:ee:ee:ee (oui Unknown), length 28
04:53:33.020152 IP (tos 0x0, ttl 64, id 49014, offset 0, flags [DF], proto TCP (6), length 52)
    10.233.102.22.39580 > nn-mgmt-tdb-2.https: Flags [.], cksum 0x7c0f (incorrect -> 0x3abb), seq 754010225, ack 136092779, win 501, options [nop,nop,TS val 2226487298 ecr 3364305571], length 0
04:53:33.021255 IP (tos 0x0, ttl 63, id 45001, offset 0, flags [DF], proto TCP (6), length 52)
    nn-mgmt-tdb-2.https > 10.233.102.22.39580: Flags [.], cksum 0x3aba (correct), seq 1, ack 1, win 501, options [nop,nop,TS val 3364335679 ecr 2226457190], length 0
04:53:51.940568 IP (tos 0x0, ttl 64, id 30960, offset 0, flags [DF], proto TCP (6), length 60)
    10.233.102.22.41288 > 172.18.234.183.5000: Flags [S], cksum 0x07f8 (incorrect -> 0xf755), seq 3539808666, win 64240, options [mss 1460,sackOK,TS val 2519137888 ecr 0,nop,wscale 7], length 0
04:53:52.956099 IP (tos 0x0, ttl 64, id 30961, offset 0, flags [DF], proto TCP (6), length 60)
    10.233.102.22.41288 > 172.18.234.183.5000: Flags [S], cksum 0x07f8 (incorrect -> 0xf35d), seq 3539808666, win 64240, options [mss 1460,sackOK,TS val 2519138904 ecr 0,nop,wscale 7], length 0
04:53:54.972153 IP (tos 0x0, ttl 64, id 30962, offset 0, flags [DF], proto TCP (6), length 60)
    10.233.102.22.41288 > 172.18.234.183.5000: Flags [S], cksum 0x07f8 (incorrect -> 0xeb7d), seq 3539808666, win 64240, options [mss 1460,sackOK,TS val 2519140920 ecr 0,nop,wscale 7], length 0
04:53:55.004242 IP (tos 0xc0, ttl 64, id 21392, offset 0, flags [none], proto ICMP (1), length 88)
    host-10-100-16-21.openstacklocal > 10.233.102.22: ICMP host 172.18.234.183 unreachable, length 68
        IP (tos 0x0, ttl 63, id 30960, offset 0, flags [DF], proto TCP (6), length 60)
    10.233.102.22.41288 > 172.18.234.183.5000: Flags [S], cksum 0xac4e (incorrect -> 0xf755), seq 3539808666, win 64240, options [mss 1460,sackOK,TS val 2519137888 ecr 0,nop,wscale 7], length 0
04:53:55.004276 IP (tos 0xc0, ttl 64, id 21393, offset 0, flags [none], proto ICMP (1), length 88)
    host-10-100-16-21.openstacklocal > 10.233.102.22: ICMP host 172.18.234.183 unreachable, length 68
        IP (tos 0x0, ttl 63, id 30961, offset 0, flags [DF], proto TCP (6), length 60)
    10.233.102.22.41288 > 172.18.234.183.5000: Flags [S], cksum 0xac4e (incorrect -> 0xf35d), seq 3539808666, win 64240, options [mss 1460,sackOK,TS val 2519138904 ecr 0,nop,wscale 7], length 0
04:53:55.004289 IP (tos 0xc0, ttl 64, id 21394, offset 0, flags [none], proto ICMP (1), length 88)
    host-10-100-16-21.openstacklocal > 10.233.102.22: ICMP host 172.18.234.183 unreachable, length 68
        IP (tos 0x0, ttl 63, id 30962, offset 0, flags [DF], proto TCP (6), length 60)
    10.233.102.22.41288 > 172.18.234.183.5000: Flags [S], cksum 0xac4e (incorrect -> 0xeb7d), seq 3539808666, win 64240, options [mss 1460,sackOK,TS val 2519140920 ecr 0,nop,wscale 7], length 0
04:53:57.084158 ARP, Ethernet (len 6), IPv4 (len 4), Request who-has 169.254.1.1 tell 10.233.102.22, length 28
04:53:57.084229 ARP, Ethernet (len 6), IPv4 (len 4), Reply 169.254.1.1 is-at ee:ee:ee:ee:ee:ee (oui Unknown), length 28
04:54:03.740123 IP (tos 0x0, ttl 64, id 49015, offset 0, flags [DF], proto TCP (6), length 52)
    10.233.102.22.39580 > nn-mgmt-tdb-2.https: Flags [.], cksum 0x7c0f (incorrect -> 0x4d1e), seq 0, ack 1, win 501, options [nop,nop,TS val 2226518018 ecr 3364335679], length 0
04:54:03.740894 IP (tos 0x0, ttl 63, id 45002, offset 0, flags [DF], proto TCP (6), length 52)
    nn-mgmt-tdb-2.https > 10.233.102.22.39580: Flags [.], cksum 0xc2b9 (correct), seq 1, ack 1, win 501, options [nop,nop,TS val 3364366399 ecr 2226457190], length 0
04:54:32.914688 IP (tos 0x0, ttl 64, id 49016, offset 0, flags [DF], proto TCP (6), length 76)
    10.233.102.22.39580 > nn-mgmt-tdb-2.https: Flags [P.], cksum 0x7c27 (incorrect -> 0x76c7), seq 1:25, ack 1, win 501, options [nop,nop,TS val 2226547192 ecr 3364366399], length 24
04:54:32.914964 IP (tos 0x0, ttl 64, id 49017, offset 0, flags [DF], proto TCP (6), length 52)
    10.233.102.22.39580 > nn-mgmt-tdb-2.https: Flags [F.], cksum 0x7c0f (incorrect -> 0x630c), seq 25, ack 1, win 501, options [nop,nop,TS val 2226547193 ecr 3364366399], length 0
04:54:32.915408 IP (tos 0x0, ttl 63, id 45003, offset 0, flags [DF], proto TCP (6), length 52)
    nn-mgmt-tdb-2.https > 10.233.102.22.39580: Flags [.], cksum 0xf116 (correct), seq 1, ack 25, win 501, options [nop,nop,TS val 3364395574 ecr 2226547192], length 0
04:54:32.915624 IP (tos 0x0, ttl 63, id 45004, offset 0, flags [DF], proto TCP (6), length 76)
    nn-mgmt-tdb-2.https > 10.233.102.22.39580: Flags [P.], cksum 0xfed8 (correct), seq 1:25, ack 26, win 501, options [nop,nop,TS val 3364395574 ecr 2226547193], length 24
04:54:32.915664 IP (tos 0x0, ttl 63, id 45005, offset 0, flags [DF], proto TCP (6), length 52)
    nn-mgmt-tdb-2.https > 10.233.102.22.39580: Flags [F.], cksum 0xf0fb (correct), seq 25, ack 26, win 501, options [nop,nop,TS val 3364395574 ecr 2226547193], length 0
04:54:32.915840 IP (tos 0x0, ttl 64, id 0, offset 0, flags [DF], proto TCP (6), length 40)
    10.233.102.22.39580 > nn-mgmt-tdb-2.https: Flags [R], cksum 0x2224 (correct), seq 754010251, win 0, length 0
04:54:32.915896 IP (tos 0x0, ttl 64, id 0, offset 0, flags [DF], proto TCP (6), length 40)
    10.233.102.22.39580 > nn-mgmt-tdb-2.https: Flags [R], cksum 0x2224 (correct), seq 754010251, win 0, length 0
04:54:38.044122 ARP, Ethernet (len 6), IPv4 (len 4), Request who-has 169.254.1.1 tell 10.233.102.22, length 28
04:54:38.044264 ARP, Ethernet (len 6), IPv4 (len 4), Reply 169.254.1.1 is-at ee:ee:ee:ee:ee:ee (oui Unknown), length 28
04:54:40.003767 IP (tos 0x0, ttl 64, id 48106, offset 0, flags [DF], proto TCP (6), length 60)
    10.233.102.22.41780 > 172.18.234.183.5000: Flags [S], cksum 0x07f8 (incorrect -> 0x4e99), seq 3264097562, win 64240, options [mss 1460,sackOK,TS val 2519185951 ecr 0,nop,wscale 7], length 0
04:54:41.020150 IP (tos 0x0, ttl 64, id 48107, offset 0, flags [DF], proto TCP (6), length 60)
    10.233.102.22.41780 > 172.18.234.183.5000: Flags [S], cksum 0x07f8 (incorrect -> 0x4aa0), seq 3264097562, win 64240, options [mss 1460,sackOK,TS val 2519186968 ecr 0,nop,wscale 7], length 0
04:54:43.036150 IP (tos 0x0, ttl 64, id 48108, offset 0, flags [DF], proto TCP (6), length 60)
    10.233.102.22.41780 > 172.18.234.183.5000: Flags [S], cksum 0x07f8 (incorrect -> 0x42c0), seq 3264097562, win 64240, options [mss 1460,sackOK,TS val 2519188984 ecr 0,nop,wscale 7], length 0
04:54:43.068154 IP (tos 0xc0, ttl 64, id 27061, offset 0, flags [none], proto ICMP (1), length 88)
    host-10-100-16-21.openstacklocal > 10.233.102.22: ICMP host 172.18.234.183 unreachable, length 68
        IP (tos 0x0, ttl 63, id 48106, offset 0, flags [DF], proto TCP (6), length 60)
    10.233.102.22.41780 > 172.18.234.183.5000: Flags [S], cksum 0xa1cc (incorrect -> 0x4e99), seq 3264097562, win 64240, options [mss 1460,sackOK,TS val 2519185951 ecr 0,nop,wscale 7], length 0
04:54:43.068183 IP (tos 0xc0, ttl 64, id 27062, offset 0, flags [none], proto ICMP (1), length 88)
    host-10-100-16-21.openstacklocal > 10.233.102.22: ICMP host 172.18.234.183 unreachable, length 68
        IP (tos 0x0, ttl 63, id 48107, offset 0, flags [DF], proto TCP (6), length 60)
    10.233.102.22.41780 > 172.18.234.183.5000: Flags [S], cksum 0xa1cc (incorrect -> 0x4aa0), seq 3264097562, win 64240, options [mss 1460,sackOK,TS val 2519186968 ecr 0,nop,wscale 7], length 0
04:54:43.068196 IP (tos 0xc0, ttl 64, id 27063, offset 0, flags [none], proto ICMP (1), length 88)
    host-10-100-16-21.openstacklocal > 10.233.102.22: ICMP host 172.18.234.183 unreachable, length 68
        IP (tos 0x0, ttl 63, id 48108, offset 0, flags [DF], proto TCP (6), length 60)
    10.233.102.22.41780 > 172.18.234.183.5000: Flags [S], cksum 0xa1cc (incorrect -> 0x42c0), seq 3264097562, win 64240, options [mss 1460,sackOK,TS val 2519188984 ecr 0,nop,wscale 7], length 0
04:56:12.006038 IP (tos 0x0, ttl 64, id 35061, offset 0, flags [DF], proto TCP (6), length 60)
    10.233.102.22.42716 > 172.18.234.183.5000: Flags [S], cksum 0x07f8 (incorrect -> 0x354d), seq 2990074799, win 64240, options [mss 1460,sackOK,TS val 2519277954 ecr 0,nop,wscale 7], length 0
04:56:13.020153 IP (tos 0x0, ttl 64, id 35062, offset 0, flags [DF], proto TCP (6), length 60)
    10.233.102.22.42716 > 172.18.234.183.5000: Flags [S], cksum 0x07f8 (incorrect -> 0x3157), seq 2990074799, win 64240, options [mss 1460,sackOK,TS val 2519278968 ecr 0,nop,wscale 7], length 0
04:56:15.036167 IP (tos 0x0, ttl 64, id 35063, offset 0, flags [DF], proto TCP (6), length 60)
    10.233.102.22.42716 > 172.18.234.183.5000: Flags [S], cksum 0x07f8 (incorrect -> 0x2977), seq 2990074799, win 64240, options [mss 1460,sackOK,TS val 2519280984 ecr 0,nop,wscale 7], length 0
04:56:15.068208 IP (tos 0xc0, ttl 64, id 31095, offset 0, flags [none], proto ICMP (1), length 88)
    host-10-100-16-21.openstacklocal > 10.233.102.22: ICMP host 172.18.234.183 unreachable, length 68
        IP (tos 0x0, ttl 63, id 35061, offset 0, flags [DF], proto TCP (6), length 60)
    10.233.102.22.42716 > 172.18.234.183.5000: Flags [S], cksum 0xe482 (incorrect -> 0x354d), seq 2990074799, win 64240, options [mss 1460,sackOK,TS val 2519277954 ecr 0,nop,wscale 7], length 0
04:56:15.068244 IP (tos 0xc0, ttl 64, id 31096, offset 0, flags [none], proto ICMP (1), length 88)
    host-10-100-16-21.openstacklocal > 10.233.102.22: ICMP host 172.18.234.183 unreachable, length 68
        IP (tos 0x0, ttl 63, id 35062, offset 0, flags [DF], proto TCP (6), length 60)
    10.233.102.22.42716 > 172.18.234.183.5000: Flags [S], cksum 0xe482 (incorrect -> 0x3157), seq 2990074799, win 64240, options [mss 1460,sackOK,TS val 2519278968 ecr 0,nop,wscale 7], length 0
04:56:15.068258 IP (tos 0xc0, ttl 64, id 31097, offset 0, flags [none], proto ICMP (1), length 88)
    host-10-100-16-21.openstacklocal > 10.233.102.22: ICMP host 172.18.234.183 unreachable, length 68
        IP (tos 0x0, ttl 63, id 35063, offset 0, flags [DF], proto TCP (6), length 60)
    10.233.102.22.42716 > 172.18.234.183.5000: Flags [S], cksum 0xe482 (incorrect -> 0x2977), seq 2990074799, win 64240, options [mss 1460,sackOK,TS val 2519280984 ecr 0,nop,wscale 7], length 0
04:56:17.116127 ARP, Ethernet (len 6), IPv4 (len 4), Request who-has 169.254.1.1 tell 10.233.102.22, length 28
04:56:17.116216 ARP, Ethernet (len 6), IPv4 (len 4), Reply 169.254.1.1 is-at ee:ee:ee:ee:ee:ee (oui Unknown), length 28
04:58:58.041218 IP (tos 0x0, ttl 64, id 27145, offset 0, flags [DF], proto TCP (6), length 60)
    10.233.102.22.44408 > 172.18.234.183.5000: Flags [S], cksum 0x07f8 (incorrect -> 0x063d), seq 2326180640, win 64240, options [mss 1460,sackOK,TS val 2519443989 ecr 0,nop,wscale 7], length 0
04:58:59.068154 IP (tos 0x0, ttl 64, id 27146, offset 0, flags [DF], proto TCP (6), length 60)
    10.233.102.22.44408 > 172.18.234.183.5000: Flags [S], cksum 0x07f8 (incorrect -> 0x023a), seq 2326180640, win 64240, options [mss 1460,sackOK,TS val 2519445016 ecr 0,nop,wscale 7], length 0
04:59:01.084163 IP (tos 0x0, ttl 64, id 27147, offset 0, flags [DF], proto TCP (6), length 60)
    10.233.102.22.44408 > 172.18.234.183.5000: Flags [S], cksum 0x07f8 (incorrect -> 0xfa59), seq 2326180640, win 64240, options [mss 1460,sackOK,TS val 2519447032 ecr 0,nop,wscale 7], length 0
04:59:01.116161 IP (tos 0xc0, ttl 64, id 3395, offset 0, flags [none], proto ICMP (1), length 88)
    host-10-100-16-21.openstacklocal > 10.233.102.22: ICMP host 172.18.234.183 unreachable, length 68
        IP (tos 0x0, ttl 63, id 27145, offset 0, flags [DF], proto TCP (6), length 60)
    10.233.102.22.44408 > 172.18.234.183.5000: Flags [S], cksum 0x51f7 (incorrect -> 0x063d), seq 2326180640, win 64240, options [mss 1460,sackOK,TS val 2519443989 ecr 0,nop,wscale 7], length 0
04:59:01.116193 IP (tos 0xc0, ttl 64, id 3396, offset 0, flags [none], proto ICMP (1), length 88)
    host-10-100-16-21.openstacklocal > 10.233.102.22: ICMP host 172.18.234.183 unreachable, length 68
        IP (tos 0x0, ttl 63, id 27146, offset 0, flags [DF], proto TCP (6), length 60)
    10.233.102.22.44408 > 172.18.234.183.5000: Flags [S], cksum 0x51f7 (incorrect -> 0x023a), seq 2326180640, win 64240, options [mss 1460,sackOK,TS val 2519445016 ecr 0,nop,wscale 7], length 0
04:59:01.116206 IP (tos 0xc0, ttl 64, id 3397, offset 0, flags [none], proto ICMP (1), length 88)
    host-10-100-16-21.openstacklocal > 10.233.102.22: ICMP host 172.18.234.183 unreachable, length 68
        IP (tos 0x0, ttl 63, id 27147, offset 0, flags [DF], proto TCP (6), length 60)
    10.233.102.22.44408 > 172.18.234.183.5000: Flags [S], cksum 0x51f7 (incorrect -> 0xfa59), seq 2326180640, win 64240, options [mss 1460,sackOK,TS val 2519447032 ecr 0,nop,wscale 7], length 0
04:59:03.260111 ARP, Ethernet (len 6), IPv4 (len 4), Request who-has 169.254.1.1 tell 10.233.102.22, length 28
04:59:03.260285 ARP, Ethernet (len 6), IPv4 (len 4), Reply 169.254.1.1 is-at ee:ee:ee:ee:ee:ee (oui Unknown), length 28
^C
51 packets captured
51 packets received by filter
0 packets dropped by kernel
nnadmin@nn-mgmt-tdb-2:~$



```

**Comment by lingxiankong** [comment]
Not sure it's related to cinder-csi-plugin, seems like networking issue.

**Comment by elgamal2020** [comment]
I can ping and connect via an openstack client from the node
How can and confirm that networking is functioning properly from the cinder pod? 
How can I troubleshoot it so it gives more information? 

Thanks a lot 
Best Regards

**Comment by jichenjc** [comment]
auth URL is ` http://172.18.234.183:5000/v3/` s 

Failed to GetOpenStackProvider: Post "http://172.18.234.183:5000/v3/auth/tokens": dial tcp 172.18.234.183:5000: connect: no route to host

host-10-100-16-21.openstacklocal > 10.233.102.22: ICMP host 172.18.234.183 unreachable,


looks like the pod is not able to reach openstack as mentioned above
1) check firewall
2) check whether other pods can reach openstack endpoint
3) check routes and others

**Comment by elgamal2020** [comment]
I have checked from the node where the CSI plugin is installed , I have an openstack client installed and I can connect to openstack as shown below 

Also firewalls is incative 


$ openstack server list
+--------------------------------------+-----------+--------+----------------------------------------------------------------------------+------------------------------------+--------+
| ID                                   | Name      | Status | Networks                                                                   | Image                              | Flavor |
+--------------------------------------+-----------+--------+----------------------------------------------------------------------------+------------------------------------+--------+
| 64f81fe9-6f01-48f6-9588-af87c4f7c3bd | security1 | ACTIVE | Internal10.20.10=10.20.10.165; internal10.20.20=10.20.20.74                | ubuntu-20.04-server-cloudimg-amd64 | 4_8_20 |
| aa902a3f-6404-45a1-bcd5-50aaf75b8af5 | inst      | ACTIVE | Internal10.20.10=10.20.10.58, 172.18.234.204; internal10.20.20=10.20.20.93 | ubuntu20                           | 1_1_10 |
+--------------------------------------+-----------+--------+----------------------------------------------------------------------------+------------------------------------+--------+


 sudo ufw status
Status: inactive




I cant exec to the csi pod , as it is always restarting , what do u advice to check the connectivity from the pod ?

**Comment by jichenjc** [comment]
I suspect `172.18.234.183` is the openstack running on and you have `172.18.234.204` as one VM
is 172.18.234.183 and 172.18.234.204 reachable to the node you are running on？

**Comment by elgamal2020** [comment]
```
yes both 

:~$ ping 172.18.234.204
PING 172.18.234.204 (172.18.234.204) 56(84) bytes of data.
64 bytes from 172.18.234.204: icmp_seq=1 ttl=62 time=4.33 ms
^C
--- 172.18.234.204 ping statistics ---
1 packets transmitted, 1 received, 0% packet loss, time 0ms
rtt min/avg/max/mdev = 4.327/4.327/4.327/0.000 ms
:~$ ping 172.18.234.183
PING 172.18.234.183 (172.18.234.183) 56(84) bytes of data.
64 bytes from 172.18.234.183: icmp_seq=1 ttl=63 time=1.54 ms
64 bytes from 172.18.234.183: icmp_seq=2 ttl=63 time=0.908 ms
^C
--- 172.18.234.183 ping statistics ---
2 packets transmitted, 2 received, 0% packet loss, time 1002ms
rtt min/avg/max/mdev = 0.908/1.221/1.535/0.313 ms
:~$

also openstack list towards the project where the node is part of the project 

nnadmin@mgmt-master-3:~$ openstack server list
+--------------------------------------+-----------------+--------+---------------------------------------------------------------------------+------------------------------------+-------------------+
| ID                                   | Name            | Status | Networks                                                                  | Image                              | Flavor            |
+--------------------------------------+-----------------+--------+---------------------------------------------------------------------------+------------------------------------+-------------------+
| 6eacf39e-94b8-44bc-bf85-f1c3dd56688c | worker-5  | ACTIVE | mgmt-net=10.100.15.101, 172.18.234.201; signaling-net=10.100.16.101 | ubuntu-20.04-server-cloudimg-amd64 | k8s-node-c4m20d40 |
| c3234b9e-b628-41e8-ad15-f6e0ed10c347 | worker-6  | ACTIVE | mgmt-net=10.100.15.100, 172.18.234.210; signaling-net=10.100.16.100 | ubuntu-20.04-server-cloudimg-amd64 | k8s-node-c4m20d40 |
| 22d753a7-c564-4361-8140-12a41e844394 | worker-4    | ACTIVE | mgmt-net=10.100.15.61, 172.18.234.208; signaling-net=10.100.16.61   | ubuntu-20.04-server-cloudimg-amd64 | k8s-node-c4m20d40 |
| ea508638-8684-440e-9a41-cb64ad868d96 | worker-3    | ACTIVE | mgmt-net=10.100.15.60, 172.18.234.209; signaling-net=10.100.16.60   | ubuntu-20.04-server-cloudimg-amd64 | k8s-node-c4m20d40 |
| 60d69fdc-b0cb-49e1-82bb-956c2f45e23f | worker-2     | ACTIVE | mgmt-net=10.100.15.51, 172.18.234.206; signaling-net=10.100.16.51   | ubuntu-20.04-server-cloudimg-amd64 | k8s-node-c4m20d40 |
| ecd761a9-5dde-4077-a0f4-4741fd21fbc8 | worker-7     | ACTIVE | mgmt-net=10.100.15.50; signaling-net=10.100.16.50                   | ubuntu-20.04-server-cloudimg-amd64 | k8s-node-c4m20d40 |
| 227a5c04-161f-4402-ab3e-a21e0504ad60 | worker-1     | ACTIVE | mgmt-net=10.100.15.41, 172.18.234.202; signaling-net=10.100.16.41   | ubuntu-20.04-server-cloudimg-amd64 | k8s-node-c4m20d40 |
| 97ad0c67-2ec5-4a44-be69-ecdc29556a09 | worker-8     | ACTIVE | mgmt-net=10.100.15.40, 172.18.234.203; signaling-net=10.100.16.40   | ubuntu-20.04-server-cloudimg-amd64 | k8s-node-c4m20d40 |
| b4d7c972-66f8-4848-8819-9dd5210634d0 | worker-9     | ACTIVE | mgmt-net=10.100.15.31, 172.18.234.188; signaling-net=10.100.16.31   | ubuntu-20.04-server-cloudimg-amd64 | k8s-node-c4m20d40 |
| 38bd5ec4-e4af-40d3-9565-4b0974a006dd | worker-10     | ACTIVE | mgmt-net=10.100.15.30, 172.18.234.200; signaling-net=10.100.16.30   | ubuntu-20.04-server-cloudimg-amd64 | k8s-node-c4m20d40 |
| ad32ac8a-9b5a-40df-afd6-d37498dc853d | mgmt-master-3   | ACTIVE | mgmt-net=10.100.15.22; signaling-net=10.100.16.22                   | ubuntu-20.04-server-cloudimg-amd64 | k8s-node-c4m20d40 |
| ea5cbc0d-b99b-456d-9f0a-96bd74a59ecf | mgmt-master-2   | ACTIVE | mgmt-net=10.100.15.21; signaling-net=10.100.16.21                   | ubuntu-20.04-server-cloudimg-amd64 | k8s-node-c4m20d40 |
| f13581cf-5a02-4649-88e2-df064760b255 | mgmt-master-1   | ACTIVE | mgmt-net=10.100.15.20; signaling-net=10.100.16.20                   | ubuntu-20.04-server-cloudimg-amd64 | k8s-node-c4m20d40 |
| 98f43ace-ecb7-4b91-8d95-0be528bc4fe7 | inst-1 | ACTIVE | mgmt-net=10.100.15.10, 172.18.234.184; signaling-net=10.100.16.10   |                                    | node-c4m16d120    |
+--------------------------------------+-----------------+--------+---------------------------------------------------------------------------+------------------------------------+-------------------+

```

**Comment by elgamal2020** [comment]
You were absolutely right , it was a network problem where I found your guidance very appreciated 

So the network issue is originated from the fact that I got 2 interfaces on the node


```

default via 10.100.16.1 dev ens4 proto dhcp src 10.100.16.21 metric 100
default via 10.100.15.1 dev ens3 proto dhcp src 10.100.15.21 metric 100
```


and connection towards to openstack should go via eth0 which is second in ip route 

so modifying the metrics of second default route make it working

```
 default via 10.100.16.1 dev ens4 proto dhcp src 10.100.16.21 metric 
default via 10.100.15.1 dev ens3 proto dhcp src 10.100.15.21 metric 300
```

As I am using ubuntu20 , the change is to be done in netplan 


network:
    version: 2
    ethernets:
        ens3:
            dhcp4: true
            set-name: ens3
            **dhcp4-overrides:
              route-metric: 0**
        ens4:
            dhcp4: true
            set-name: ens4
            **dhcp4-overrides:
              route-metric: 300**

Thanks again and have an excellent weekend

will be happy to provide additional clarifications , also I guess it will be useful to add some debugging tools into the csi plugin pod

**Comment by jichenjc** [comment]
glad it works for you :)
